date,time,user_name,text,link,retweet_counts,favorite_counts
2019-10-18,11:33:42,allforminnie,[MPD직캠] (여자)아이들 민니 직캠 4K '싫다고 말해(Nightmare Ver.)' (MINNIE FanCam) | @퀸덤_... https://youtu.be/myu-SJJwRYQ via @YouTube,https://twitter.com/allforminnie/status/1185157001539702787,2,5
2019-10-18,11:32:39,hypersweets221,"엠넷 퀸덤.. 십오분만 주면 안되겟니 역대급 무대 한번 만들어보고 십지 않니 . . 아미슈 정말 너무 좋았지만 사실 마마무는 그보다 환상적인 무대들이 더 많다는 사실,, 화제성애 환장하는 관종방송국으로서 자존심 상한다면 15분 주세요 흑흑",https://twitter.com/hypersweets221/status/1185156734047920129,0,12
2019-10-18,11:31:56,QTNYwucBekFbUeZ,는 우라질 걍 퀸덤 재작진에게 편곡이랑 맡기지 그랬냐 별.. 관심없던 노래도 기깔나게 뽑드라 콜라보라메 서로의 장점을 부각시켜야지.. 솔ㅉㅋ 뮤비도 아닌것을 또.. 그냥 우연한 기회에 한곡 불렀다 역시 잘하더라 이랬으면 이렇게 기대도 않했지 이건 뭐 이렇게 우습게 보나 싶고 쯪,https://twitter.com/QTNYwucBekFbUeZ/status/1185156556620468225,0,0
2019-10-18,11:30:18,riselinia,퀸덤 너무 재미썽,https://twitter.com/riselinia/status/1185156145515847680,0,2
2019-10-18,11:28:31,HNN8cGh5FLCOBj7,앨범 민희 구성 바꾸시분 찾아요 비상 포카 남도현 북마크 남도현 등신대 김우석 퀸덤 포카 차준호 북마크 송형준 등신대 김요한 모두 강민희로 구합니다,https://twitter.com/HNN8cGh5FLCOBj7/status/1185155695647305728,0,0
2019-10-18,11:28:24,S2_MOHA,엠넷 유튜브채널.. 퀸덤으로 존나 잘해먹고있네...,https://twitter.com/S2_MOHA/status/1185155667184750592,0,0
2019-10-18,11:27:33,__crazyfruit__,아 이게 뭐예욬ㅋㅋㅋㅋㅋㅋㅋㅋㅋㅋ 웃겨ㅋㅋㅋㅋㅋㅋㅋㅋㅋㅋㅋㅋ 퀸덤과몰입오타쿠 짝꿍이냐구요ㅋㅋㅋㅋ(맞음,https://twitter.com/__crazyfruit__/status/1185155451572359169,0,0
2019-10-18,11:26:15,justaumm,[MPD직캠] 에이오에이 지민 직캠 4K 'T4SA+Puss' (JIMIN FanCam) | @퀸덤_2019.10.17 https://youtu.be/SOhayfdtSZI via @YouTube,https://twitter.com/justaumm/status/1185155125867941889,0,0
2019-10-18,11:26:00,Brave_ATM,퀸덤 아이들무대진짜오진다몇번보고잇는건지 전소연천재임,https://twitter.com/Brave_ATM/status/1185155061279838209,0,5
2019-10-18,11:25:49,ff_Chatti,아쉬 퀸덤 이번 오마이걸 곡 트와일라잇이래 다들 이거 봐주세요 이게 뱀파이어가 된대잔아 미친거아냐 ,https://twitter.com/ff_Chatti/status/1185155017172488192,0,1
2019-10-18,11:25:39,seomii_,#퀸덤 #싫다고말해 민니 어제 무대 너무 개 쩔었어ㅠㅜ,https://twitter.com/seomii_/status/1185154973430099970,6,10
2019-10-18,11:25:36,S2_MOHA,퀸덤 15년만 하자 너무길게말고 딱 15년만,https://twitter.com/S2_MOHA/status/1185154963145744384,0,1
2019-10-18,11:24:57,lotto1st_kim,아 퀸덤 8회도 얼른 보고 싶은데 ㅠㅠㅠ 오늘 할 일 다 못했어...그리고 이 상황에서 퀸덤 8회 주입되면 나 정신 못차릴듯...,https://twitter.com/lotto1st_kim/status/1185154796652843008,0,0
2019-10-18,11:24:38,null_num,@__crazyfruit__ 루시 별루 말 없다가 오늘 아침에 갑자기 퀸덤 봤냐고 전소연에 대해서 줄줄줄 얘기해서 너무 웃겼어. 좀 있다 퀸덤 영상 같이 보기로 함ㅋㅋㅋㅋㅋㅋㅋ,https://twitter.com/null_num/status/1185154718068285441,1,2
2019-10-18,11:23:03,kymmoomaengja,[ENG sub] [2회] ♬ LATATA - (여자)아이들 @1차 경연ㅣ히트곡 대결 컴백전쟁 : 퀸덤 2화 https://youtu.be/Knz0j_G7lKg ผ่าน @YouTube,https://twitter.com/kymmoomaengja/status/1185154320079163392,0,0
2019-10-18,11:22:51,somciit_39,퀸덤 투표 지금 할 수 있나 어디서 하지,https://twitter.com/somciit_39/status/1185154269185560576,0,0
2019-10-18,11:20:02,1QOgSRokJmmSpA5,[AOA] [MR Removed][퀸vs퀸] AOA '짧은 치마' (Queen vs Queen AOA 'Miniskirt') @퀸덤(Queendom) http://dlvr.it/RGSF2y,https://twitter.com/1QOgSRokJmmSpA5/status/1185153562294341633,0,0
2019-10-18,11:19:11,soldnationer,와 씨바 퀸덤 아이들 무대 봤는데 레알 지렸다 미친거아님???????!!!!? 내가 좀만 더 정신 잇엇으면 프레임단위로 파고잇엇음ㄹㅇ,https://twitter.com/soldnationer/status/1185153347537592322,0,4
2019-10-18,11:18:42,jung_pm,지금 퀸덤의 모든 강아지상들에게 또치여서 전치 800주,https://twitter.com/jung_pm/status/1185153224204009472,0,0
2019-10-18,11:18:25,marrywithhj,아 퀸덤 지호랑 솔라 리액션 때문에 미치겠음ㅋㅋㅋ큐ㅠㅠㅠㅠ,https://twitter.com/marrywithhj/status/1185153155237068802,0,0
2019-10-18,11:17:59,ganzibae0510,아 퀸덤 봐야돼,https://twitter.com/ganzibae0510/status/1185153044142534656,0,0
2019-10-18,11:17:43,tt__N1,하 퀸덤 수진 최고임 진짜 최곤데 파워 무대 어째서 3위 ㅠㅠ..............,https://twitter.com/tt__N1/status/1185152976878559233,0,0
2019-10-18,11:17:14,nooyang_,이번 퀸덤 진짜 컨셉 좋았다ㅠㅠ 그리고 오늘 점심시간에 노래 틀어주는데 싫다고말해(나잍메어버전) 나와서 굉장히 기분 좋았ㅇ다!!,https://twitter.com/nooyang_/status/1185152857311461377,0,6
2019-10-18,11:16:47,kisa_harume,[풀버전] ♬ 너나 해(Egotistic) - AOA @2차 경연 컴백전쟁 : 퀸덤 3화 https://youtu.be/n-w_ski7mt0 @YouTube 님이 공유,https://twitter.com/kisa_harume/status/1185152742823776258,0,0
2019-10-18,11:15:42,tianmiyuqi,퀸덤 싫다고 말해 킬링파트 #여자아이들 #G_I_DLE #퀸덤 #싫다고말해 #미연 #민니 #수진 #소연 #우기 #슈화,https://twitter.com/tianmiyuqi/status/1185152467916472321,1295,1272
2019-10-18,11:15:20,jotpok_manulll,퀸덤 장성규짜르고 김신영 캐스팅해아 시청률5프로 오름,https://twitter.com/jotpok_manulll/status/1185152378821062657,0,0
2019-10-18,11:14:49,IXXp8zmh0KOQmWR,진짜 퀸덤 완전 좋아.... 다들 너무너무 소듕하고 막ㅠㅠㅠㅠ 퀸덤 나온 전부 흥해라!!!!,https://twitter.com/IXXp8zmh0KOQmWR/status/1185152247107375104,0,1
2019-10-18,11:14:41,jung_pm,큰일이다 6그룹 전부 퀸덤이 끝나면 다함께 청춘불패 즌2를 찍자 모두 함께 즐겁게 엉켜놀자 퀸덤 끝나면 이제 뭐하냐고 삼시세기도 끗난다구 무슨 재미루 살아,https://twitter.com/jung_pm/status/1185152213766811650,0,1
2019-10-18,11:14:39,yamaissan,퀸덤에서 화사한테 준 김밥 바르다 김선생 참치김밥으로 밝혀져 ... ,https://twitter.com/yamaissan/status/1185152203373338624,1,0
2019-10-18,11:14:28,singingmybluez,"[VOTE NOW]컴백 전쟁 퀸덤&gt; 최종 1위는 누구? 최애돌에게 투표하고, Final 경연 보러가자! ",https://twitter.com/singingmybluez/status/1185152158070644741,0,0
2019-10-18,11:14:21,mihodayo_64,와 여자아이들 퀸덤 무대 진짜ㅓㅜㅠㅓ,https://twitter.com/mihodayo_64/status/1185152131474644992,0,0
2019-10-18,11:14:06,jotpok_manulll,러블리즈 오마걸은 이번에 퀸덤 나온거 개잘한듯 ㅠㅜㅜㅜㅜ 그리고 아이들은 아이돌의 신이다,https://twitter.com/jotpok_manulll/status/1185152065892425729,0,0
2019-10-18,11:14:01,Eunha_v__v,퀸덤봤다ㅠㅠ근데 아직 뒤에 한편 더 있는데 하루에 한편보기로 정해서...라섹한지 11일째라.......아니 보컬유닛들 장난아니네ㅠㅠ,https://twitter.com/Eunha_v__v/status/1185152044245626880,0,1
2019-10-18,11:13:03,allforminnie,[Full CAM] ♬ 싫다고 말해(Nightmare Ver.) - (여자)아이들((G)I-DLE) 4K 직캠 @3퀸덤 차 경연 https://youtu.be/TghPFo0T5_c via @YouTube,https://twitter.com/allforminnie/status/1185151803928780800,1,2
2019-10-18,11:12:56,allforminnie,[퀸' Story] 혜정&민니 'instagram' @퀸덤 3차 R1 경연 https://youtu.be/aMc-0OiKawY via @YouTube,https://twitter.com/allforminnie/status/1185151771607552000,0,1
2019-10-18,11:12:54,panjujuju,퀸덤처음에 여적여구도 자꾸 잡는다매 어디까지글케되는거임?,https://twitter.com/panjujuju/status/1185151767136395264,0,0
2019-10-18,11:12:45,allforminnie,[퀸' Story] (여자)아이들 '싫다고 말해(Nightmare Ver.)' @퀸덤 3차 R2 경연 https://youtu.be/gNX2lU_ub4c via @YouTube,https://twitter.com/allforminnie/status/1185151727277871105,0,0
2019-10-18,11:12:40,jotpok_manulll,퀸덤 ㅠㅜㅜㅜㅜ ,https://twitter.com/jotpok_manulll/status/1185151704867758080,0,0
2019-10-18,11:12:30,SPRITEWITH1AO29,헐 얼마전에 퀸덤에서 민니가 입었던 옷 정보 찾아냈다,https://twitter.com/SPRITEWITH1AO29/status/1185151666246561799,0,4
2019-10-18,11:12:03,convalliria,퀸덤 동반인 신청 하실분 있나요..??,https://twitter.com/convalliria/status/1185151550492155905,0,0
2019-10-18,11:11:21,ohmygirl_chef,햐.. 퀸덤 팡탈이네... ㅋㅋㅋㅋㅋㅋㅋ,https://twitter.com/ohmygirl_chef/status/1185151373320609792,0,0
2019-10-18,11:11:21,Mrchudnlt14,퀸덤 아이들 상 줘야된다 진짜 어제 보고 헉해서 돌았잖아,https://twitter.com/Mrchudnlt14/status/1185151372922118146,0,0
2019-10-18,11:10:04,naztan8,[퀸' Story] (여자)아이들 '싫다고 말해(Nightmare Ver.)' @퀸덤 3차 R2 경연 ,https://twitter.com/naztan8/status/1185151053873983490,0,0
2019-10-18,11:09:50,mamedeath_,퀸덤 보는데 우기는 발음만 좋은게 아니라 어휘 구사력도 걍 한국인이네 네이티브 아닌게 정말 안믿김,https://twitter.com/mamedeath_/status/1185150991227858945,0,0
2019-10-18,11:09:35,Wheein_cute0417,혹싀 이번 퀸덤 아미슈때 휜 사진 가지고 있는부운ㅜㅠ저 좀 주세요오,https://twitter.com/Wheein_cute0417/status/1185150932251824129,0,1
2019-10-18,11:08:14,green107__,나 숙소 도착했고 뭐 할거냐면 밥 먹으면서 퀸덤 볼거야,https://twitter.com/green107__/status/1185150590084669441,0,2
2019-10-18,11:08:04,jung_pm,"퀸덤 10시즌 했으면 좋겠다 일일 예능으로 했으면 좋겠어 매일 퀸덤을 보고 싶어요,,,",https://twitter.com/jung_pm/status/1185150550226145280,0,0
2019-10-18,11:07:31,tntpal__,퀸덤2땐 드림캐쳐도 불러오자,https://twitter.com/tntpal__/status/1185150409389858816,0,0
2019-10-18,11:05:07,matale777,[ENG sub] [3회] ♬ 한(一) feat.치타 - 박봄 @2차 경연ㅣ커버곡 대결 컴백전쟁 : 퀸덤 3화 https://youtu.be/QxOr7l7utUo via @YouTube,https://twitter.com/matale777/status/1185149805724622849,0,0
2019-10-18,11:04:26,popbyun41,[MPD직캠] (여자)아이들 민니 직캠 4K '싫다고 말해(Nightmare Ver.)' (MINNIE FanCam) | @퀸덤_... https://youtu.be/myu-SJJwRYQ ผ่าน @YouTube,https://twitter.com/popbyun41/status/1185149633804341248,0,0
2019-10-18,11:03:05,ao_heartattack,ぷええ〜〜〜ん って泣くユアたま、プレシャス... [ENG sub] [8회] '뿌에엥ㅜ^ㅜ' 돌고래 사운드와 눈물이 넘치는 퍼포먼스 1위의 대기실 컴백전쟁 : 퀸덤 8화 ,https://twitter.com/ao_heartattack/status/1185149295168610308,0,0
2019-10-18,11:02:08,koktwt,퀸덤에 승희 잡힐 때마다 진짜 빵터져욬ㅋㅋㅋㅋ,https://twitter.com/koktwt/status/1185149054235185152,0,1
2019-10-18,11:00:02,yeodolgaesarang,"ㅋㅋㅋㅋㅋㅋㅋㅋㅋ퀸덤에서 개인적으로 웃긴 점 맴의 신지민 씨의 노래를 전부터 굉장히 사랑하시던 마마무의 김용선 씨,,, 두 분 동갑",https://twitter.com/yeodolgaesarang/status/1185148527933943809,0,1
2019-10-18,10:57:39,SseungOhmy,담주 굉장히 기대된다... 저 호랑이 눈빛 어떡할거야 진짜 #오마이걸_퀸덤 #오마이걸_지호,https://twitter.com/SseungOhmy/status/1185147928093941762,0,6
2019-10-18,10:56:20,SseungOhmy,아린이 달달달 떠는거 너무 귀여워ㅠㅠㅜㅜ #퀸덤_오마이걸 #아린,https://twitter.com/SseungOhmy/status/1185147597515657217,90,136
2019-10-18,10:56:20,ivemml,퀸덤볼때마다 너무 행복해,https://twitter.com/ivemml/status/1185147596144119808,0,0
2019-10-18,10:55:27,SseungOhmy,집중하는 씅 #퀸덤 #오마이걸,https://twitter.com/SseungOhmy/status/1185147374865240069,1,4
2019-10-18,10:55:20,lmres1026,나 퀸덤 맘무님들 무대 보는데 연생때 영상 틀어주는 거 보고 은상이 연생시절 생각나서 혼자 울컥,https://twitter.com/lmres1026/status/1185147343357669376,0,1
2019-10-18,10:54:42,Sth_fresh,아이구 브이오디로 퀸덤을 봅시다,https://twitter.com/Sth_fresh/status/1185147186813648902,0,0
2019-10-18,10:54:38,mahiru_chudol,퀸덤♡@@@@@@@,https://twitter.com/mahiru_chudol/status/1185147168132173830,0,0
2019-10-18,10:54:32,mmmmss95,퀸덤에서 뉴미슈 너무 좋았음 (근데!!! 칠해줘 듣고싶어ㅓㅓㅓㅓㅓㅓㅓ 이것도 보컬적 퍼포먼스 쩌는데 아니야...뉴미슈도 만족해,https://twitter.com/mmmmss95/status/1185147144493125632,0,0
2019-10-18,10:53:44,zeze_zy,퀸덤 재방 아이들에서 감탄했고 마마무에서 울었고 AOA에서 그때를 추억했다.,https://twitter.com/zeze_zy/status/1185146943397253120,0,7
2019-10-18,10:52:36,_7thSept,ปลุกความเป็นมูมู่ในตัวคุณออกมา น้ำตาจะไหล ปลิ่มมากกก [퀸' Story] 마마무 'I Miss You' @퀸덤 3차 R2 경연 https://youtu.be/4Xw82n8nkfs via @YouTube,https://twitter.com/_7thSept/status/1185146655747633152,0,0
2019-10-18,10:50:50,Hp_Dairen,"미친, 여자 너무 좋아 미친여자도 너무 좋아!! (사랑해요 퀸덤&lt;)",https://twitter.com/Hp_Dairen/status/1185146212376141824,0,0
2019-10-18,10:50:36,ch0sshi,[퀸' Story] 마마무 'I Miss You' @퀸덤 3차 R2 경연 ,https://twitter.com/ch0sshi/status/1185146152078970880,97,143
2019-10-18,10:50:26,Hp_Dairen,ㅋㅋㅋ 나 OTP 해놓은 상태로 퀸덤ㅋㅋㅋ 보다가 시간 만료됐어..반해버린거예요,https://twitter.com/Hp_Dairen/status/1185146112778260482,0,0
2019-10-18,10:50:18,me_960612,앗 오늘 좀 바빠서 근무시간에 퀸덤 못 봤네;;;,https://twitter.com/me_960612/status/1185146076866600962,0,0
2019-10-18,10:47:52,cheongryong_,퀸덤 보는데 지민 개멋져,https://twitter.com/cheongryong_/status/1185145465005674496,0,0
2019-10-18,10:47:12,press_ID_,퀸덤에서 박봄이 젤리 야금야금 먹는거 찾으려고 서치했다가 그녀가 예전에 젤리에 약을 숨겨왔던 어둠의 과거만 나왔고 젤리를 예전부터 좋아했었군요.. 귀엽다,https://twitter.com/press_ID_/status/1185145296088518657,0,0
2019-10-18,10:46:28,0u_u4,퀸덤 더 들어와줘 진짜 나 오늘 아이들 영상만 37388373838번은 본거같아 잊혀지ㅣ지가 안하,https://twitter.com/0u_u4/status/1185145113732767745,0,1
2019-10-18,10:46:20,yunanmi,[퀸' Story] AOA '질투 나요 BABY+T4SA+Puss' @퀸덤 3차 R2 경연 https://youtu.be/m_bMvNpNv1k via @YouTube,https://twitter.com/yunanmi/status/1185145079645835264,1,3
2019-10-18,10:46:18,aaooaaooaoao,빨리 3기 모집해 퀸덤끝나고,https://twitter.com/aaooaaooaoao/status/1185145068996325376,0,1
2019-10-18,10:45:19,dino_Ely6121,퀸덤 다시보기 마저봐야지ㅋㅋㅋㅋ,https://twitter.com/dino_Ely6121/status/1185144822564192257,0,0
2019-10-18,10:44:47,silentcannon,약간 퀸덤 다음이 싱글 나오는데 애들이 글케 퍼포 잘하는데 이딴 곡 내주냐 항의 들을까봐 지금 라운드 평이한거 퍼포먼스 하는거 아닐까..?라는 상상을 해봄,https://twitter.com/silentcannon/status/1185144688606466049,0,0
2019-10-18,10:44:16,thisisnamnam,พี่มุนในชุดนี้ก็ยังหล่อ เฮ้อ [풀버전] ♬ I Miss You - 마마무 @3차 경연 컴백전쟁 : 퀸덤 8화 https://youtu.be/3ELYg8XilJY via @YouTube,https://twitter.com/thisisnamnam/status/1185144558184620033,0,0
2019-10-18,10:43:53,189_KN,내가 남돌 빨 때는 꼭 본진이 있고 최애가 있었는데 여돌 빨고 퀸덤 본 이후로 본진이 뭐고 최애가 뭔지 까먹음 어떻게 한 그룹만 한 명만 좋아하나요 다 사랑하는데 내가 이 시대의 의자왕이다 개같은 대결구도 버리고 퀸덤 평생 방송해 줘,https://twitter.com/189_KN/status/1185144461044543488,0,0
2019-10-18,10:43:17,AHJ0723,191017 퀸덤 #마마무 #화사 http://bit.ly/31rjtx6,https://twitter.com/AHJ0723/status/1185144313811849216,116,286
2019-10-18,10:43:15,daegers_eage,아 또 퀸덤 또까먹었다,https://twitter.com/daegers_eage/status/1185144302634057730,0,0
2019-10-18,10:42:42,Yuum_mmm,아니.. 어제 상태 안 좋았어서 퀸덤 못 봐서 방금 봤는 데 펑펑 울었다...,https://twitter.com/Yuum_mmm/status/1185144166101045251,0,0
2019-10-18,10:42:31,mooparty822,"[VOTE NOW]컴백 전쟁 퀸덤&gt; 최종 1위는 누구? 최애돌에게 투표하고, Final 경연 보러가자! ",https://twitter.com/mooparty822/status/1185144117942091776,0,0
2019-10-18,10:41:45,LIVIG_1122,퀸덤 3차경연 직접봤으면 정말 감동 엄청받고 눈물났을거같다. 팬들한테 시작과 지금을 선물한거잖아 팬을위한 무대 너무 좋았다,https://twitter.com/LIVIG_1122/status/1185143924861464576,0,0
2019-10-18,10:41:40,Biryu_vrc,퀸덤 아이들 싫다고 말해 무대 풀영상 보는데 너무 쩔어서 충격먹음 너무좋아진짜미쳐,https://twitter.com/Biryu_vrc/status/1185143907018919937,0,2
2019-10-18,10:40:50,yj981205,Aoa 최애 설현인데 몇년전에 확 뜬 후로 퀸덤에서도 얼굴을.ㅜ찾아볼수가없어....... 차애는 지민 성격이 너무 좋아 사귀어주세요하고싶음,https://twitter.com/yj981205/status/1185143696552951808,0,0
2019-10-18,10:40:31,YuqiBoogie_i,에오에 개극호 진짜 아 퀸덤 아,https://twitter.com/YuqiBoogie_i/status/1185143614441025536,0,0
2019-10-18,10:40:10,__joons,퀸덤 첨보는데 넘 걸그룹 매력넘치는,https://twitter.com/__joons/status/1185143525995761664,0,0
2019-10-18,10:38:39,user_friendly__,why is (G)I-DLE is ranking so low when they're doing so well???? what is this? what is HAPPENING #queendom #퀸덤,https://twitter.com/user_friendly__/status/1185143147128655873,0,5
2019-10-18,10:37:15,um_mmmhm,퀸덤 재방 보는데...너무...너무 최고다 언니들 개사랑함,https://twitter.com/um_mmmhm/status/1185142794463039489,0,1
2019-10-18,10:36:25,CdCY_168,퀸덤 재방 보고있음 지민언니 너무 좋아ㅠ,https://twitter.com/CdCY_168/status/1185142582772256768,0,0
2019-10-18,10:35:55,ohmygirl_chef,에휴.. 퀸덤이 빨리 끝나야 애들이 좀 쉴텐데,https://twitter.com/ohmygirl_chef/status/1185142459975602176,0,0
2019-10-18,10:35:41,vanilla_latte_L,퀸덤 보면서 몇 번을 우는거야ㅠ엉엉,https://twitter.com/vanilla_latte_L/status/1185142398210306049,0,2
2019-10-18,10:34:18,mmm160506,퀸덤 재방송 보다가 또 울컥ㅠ,https://twitter.com/mmm160506/status/1185142052998135808,0,1
2019-10-18,10:34:09,AkfVttQy1z018cO,선멘 감사합니다ㅠ♡♡퀸덤2차경연부터 봤었는데 세상에..입덕했죠...,https://twitter.com/AkfVttQy1z018cO/status/1185142013261279232,0,1
2019-10-18,10:33:33,melon_a_,"퀸덤 다시 보는데 진짜 아이들 누가 이겨,,,,,,",https://twitter.com/melon_a_/status/1185141861834346497,0,0
2019-10-18,10:33:26,mayzkjy,[ENG sub] [3회] ♬ 한(一) feat.치타 - 박봄 @2차 경연ㅣ커버곡 대결 컴백전쟁 : 퀸덤 3화 https://youtu.be/QxOr7l7utUo via @YouTube,https://twitter.com/mayzkjy/status/1185141831555633153,0,0
2019-10-18,10:32:12,nayeah_cos,나 방금 러닝머신 뛰면서 재방으로 퀸덤 봤는데 아이들 오져 쩐당,https://twitter.com/nayeah_cos/status/1185141524373180417,0,1
2019-10-18,10:32:06,Hana24713063,엥? 퀸덤 안봐서 몰랐는데 아이들 무대 꼴찌임? 존나 어이가 도둑 맞은 기분,https://twitter.com/Hana24713063/status/1185141497814908928,0,1
2019-10-18,10:31:00,monsamee,이거 퀸덤 파생효과맞지..,https://twitter.com/monsamee/status/1185141218793021440,0,0
2019-10-18,10:30:09,SI_MON_G,방금 퀸덤 재방하는거 엄마가 아이들 무대 보면서 하이고... 아이고... 오.. 애기들 잘 해야하는데 ㅠㅠ &lt;하는거 넘 웃긴,https://twitter.com/SI_MON_G/status/1185141006187945985,0,0
2019-10-18,10:30:04,stargardienchuk,어제 퀸덤 봣는디 아이들 넘 멋지더라,https://twitter.com/stargardienchuk/status/1185140986860621824,0,0
2019-10-18,10:29:43,readytoFLH,[MPD직캠] (여자)아이들 민니 직캠 4K '싫다고 말해(Nightmare Ver.)' (MINNIE FanCam) | @퀸덤_... https://youtu.be/myu-SJJwRYQ - @YouTube 민니 천재 같애 진심 1초도 버릴 구간이 없어..,https://twitter.com/readytoFLH/status/1185140898318802944,0,0
2019-10-18,10:28:14,hanaedan,퀸덤방청.. 댓림천재 친구손에맡겻다....,https://twitter.com/hanaedan/status/1185140524648288256,0,0
2019-10-18,10:27:22,Jin35910,나는 퀸덤을 보면서 매번 무대에 감탄하기도 하지만 팀끼리 같이 이야기 나누고 서로 위로하고 울고 웃는 모습이 그렇게 부럽더라,https://twitter.com/Jin35910/status/1185140307274297344,0,5
2019-10-18,10:27:13,macamacasock,"이번 퀸덤 진짜.. 진짜 충격적이다. 여자아이들 무대 너무.. 너무 좋다. 끔찍이도 아름다운 구울들같아. 이건 이별노래지만 사실 철저히 여자들을 위한 노래다. 노래도 그렇고 무대도 그렇다. 남자는 좀비, 혹은 정체를 알 수 없는 괴물 같고, 여자는 립스틱을 지우고 머리를 망가뜨리며 혼자가 된다.",https://twitter.com/macamacasock/status/1185140269466841093,0,0
2019-10-18,10:27:08,Hero_u_u,퀸덤기획의도랑 다 엄청..욕햇는데 그럼에도 불구하고 여돌들이 스스로 컨셉을 정하고 하고싶은 걸 하는 모습이 너무 즐겁기 때문에,https://twitter.com/Hero_u_u/status/1185140248172347392,0,0
2019-10-18,10:27:08,Hero_u_u,킹덤말구 퀸덤2햇으면 좋겟어,https://twitter.com/Hero_u_u/status/1185140246230388737,0,0
2019-10-18,10:26:48,tianmiyuqi,[퀸' Story] 혜정&민니 'instagram' @퀸덤 3차 R1 경연 https://youtu.be/aMc-0OiKawY - @YouTube,https://twitter.com/tianmiyuqi/status/1185140163636125698,0,4
2019-10-18,10:24:43,plantlove82,퀸덤 보다보니 (여자)아이들 무대 정말 대단하다. 멋지다. 소름 돋음.,https://twitter.com/plantlove82/status/1185139640681951232,0,0
2019-10-18,10:24:16,yoikjja,여...친 친구.들과 여친.은 여자아이돌 처돌.이 및 걍 남자아.이돌도 좋아한.다 그래서 만.나면 퀸.덤 같은거... 틀어놓는데 셋은. 개열심.히보고 나만...멍때리는 중 와인먹는.데 응,https://twitter.com/yoikjja/status/1185139527955841024,1,1
2019-10-18,10:24:16,tianmiyuqi,[퀸' Story] (여자)아이들 '싫다고 말해(Nightmare Ver.)' @퀸덤 3차 R2 경연 https://youtu.be/gNX2lU_ub4c - @YouTube,https://twitter.com/tianmiyuqi/status/1185139524457775104,1,4
2019-10-18,10:22:52,_dusk_till_down,퀸덤 보는중,https://twitter.com/_dusk_till_down/status/1185139173696536576,0,0
2019-10-18,10:22:51,godaepeople,사람들 다 퀸덤볼때 내혼자 케이온보고 오자마녀 도레미 보고잇음,https://twitter.com/godaepeople/status/1185139171263778816,0,0
2019-10-18,10:22:50,exodus098,와...지민 국힙찔이들 다 저격하고 있어...ㅠㅜ(퀸덤 3회 정주행중),https://twitter.com/exodus098/status/1185139167291830277,0,0
2019-10-18,10:22:39,ssuzzy__,와 퀸덤 어제꺼 보는데 아이들 미쳤네 진짜로……,https://twitter.com/ssuzzy__/status/1185139119921324032,0,0
2019-10-18,10:22:12,KPWM_CHA3NG,何度観ても泣ける。 [ENG sub] [8회] '뿌에엥ㅜ^ㅜ' 돌고래 사운드와 눈물이 넘치는 퍼포먼스 1위의 대기실 컴백전쟁 : 퀸덤 8화 https://youtu.be/TvbjER7cndw @YouTubeさんから,https://twitter.com/KPWM_CHA3NG/status/1185139005567844352,0,0
2019-10-18,10:21:30,kkingkkangpark,가사도 너무 좋고 무대구성도좋고 가창력까지 너무 완벽하다 눈물날뻔했다 [ENG sub] [8회] ♬ I Miss You - 마마무 @3차 경연 팬도라의 상자 컴백전쟁 : 퀸덤 8화 https://youtu.be/IjEue6SqJjI - @YouTube,https://twitter.com/kkingkkangpark/status/1185138828870184960,0,0
2019-10-18,10:21:25,_kang_moon,아미친 퀸덤 아이들 쩐다 대박이다,https://twitter.com/_kang_moon/status/1185138808091639809,0,0
2019-10-18,10:20:07,roooooooom,このシーン、ホント好き ユアたま、きっとすごく頑張ったんだなぁ あぁ好き [ENG sub] [8회] '뿌에엥ㅜ^ㅜ' 돌고래 사운드와 눈물이 넘치는 퍼포먼스 1위의 대기실 컴백전쟁 : 퀸덤 8화 ,https://twitter.com/roooooooom/status/1185138482550693888,0,0
2019-10-18,10:19:08,gen_giraffe,[퀸' Story] AOA '질투 나요 BABY+T4SA+Puss' @퀸덤 3차 R2 경연 https://youtu.be/m_bMvNpNv1k @YouTubeさんから,https://twitter.com/gen_giraffe/status/1185138235166490624,0,0
2019-10-18,10:19:02,mysunnniii,ไอดอลหญิงคนแรกที่หัดวาด ขอให้มินนี่เปล่งประกายขึ้นไปเรื่อยๆ มีคนรักหนูเยอะๆเลยนะ #G_I_DLE #아이들 #gidlefanart #여자아이들 #minnie #민니 #퀸덤 #WahlyFanart,https://twitter.com/mysunnniii/status/1185138208511676417,113,115
2019-10-18,10:18:55,tianmiyuqi,민니도 퀸덤 모니터 하고선 자기 아닌 것 같았대ㅠ 너무 무섭다구,https://twitter.com/tianmiyuqi/status/1185138178505592833,0,13
2019-10-18,10:18:41,dohstype,퀸덤 보면서 먹겟다 ,https://twitter.com/dohstype/status/1185138119655346176,0,2
2019-10-18,10:17:27,hwasa_videobot,우리 화둘기 퀸덤에서 공식적으로 비둘기가 된 그 날 정말 숙면을 못했대ㅠㅂ.ㅠ 우리 혜지니 쉬게 해 죠라ㅠㅠㅠㅠㅠ #마마무 #화사 #HWASA,https://twitter.com/hwasa_videobot/status/1185137809696313344,66,166
