date,time,user_name,text,link,retweet_counts,favorite_counts
2019-10-17,16:35:02,avu_SHiKA,[8회] ♬ 싫다고 말해(Nightmare Ver.) - (여자)아이들 @3차 경연 팬도라의 상자 컴백전쟁 : 퀸덤 8화 https://youtu.be/TorT6Rgl-Kc @YouTubeより ナイトメアver.だからおどろおどろしい雰囲気だったけどウギたんの顔面が相変わらずかわちいすぎてニッコニコになってしまった,https://twitter.com/avu_SHiKA/status/1184870444756680704,0,0
2019-10-17,16:35:01,NB_Greenteacar,실트 거의 퀸덤 이길래 가봤죠 아이들 무대에 지리고 마마무 무대에 울었습니다,https://twitter.com/NB_Greenteacar/status/1184870438708449280,0,2
2019-10-17,16:34:57,huwa_92,퀸덤 보구 자까 이따 낮에 보까 고민이다,https://twitter.com/huwa_92/status/1184870425634852864,0,0
2019-10-17,16:34:48,Total_day,와..진짜 이번 퀸덤 너무 짱이다 전부다 순위권해라 그냥ㅠㅠ 이걸 어떻게 나눠,https://twitter.com/Total_day/status/1184870384002199552,1,1
2019-10-17,16:34:39,Soo_817,다행이다 퀸덤 2차경연때 입덕해서....지금입덕했으면 큰잏날뻔,https://twitter.com/Soo_817/status/1184870346454814721,0,0
2019-10-17,16:34:26,KimMinnieS,퀸덤 너네 근데 왜 유닛무대 음원은 안 내주냐... 아아팀 인스타그램 음원 오래 기다려..,https://twitter.com/KimMinnieS/status/1184870293686251520,0,0
2019-10-17,16:34:23,melon_a_,하 오늘 장성규 나오는 부분 스킵하면서 퀸덤 봤는데 너무 재밌다 장성규때문에 결제해서 본다 안 보려고 ㅅㅂ 개빡치네,https://twitter.com/melon_a_/status/1184870279832469504,0,0
2019-10-17,16:34:07,G4M3_LILAS,오늘 퀸덤 옴걸 나왓나요???,https://twitter.com/G4M3_LILAS/status/1184870212379631617,0,0
2019-10-17,16:34:05,ppkty309,ดีมากแบบมากๆๆๆๆๆๆ #Queendom [풀버전] ♬ I Miss You - 마마무 @3차 경연 컴백전쟁 : 퀸덤 8화 https://youtu.be/3ELYg8XilJY via @YouTube,https://twitter.com/ppkty309/status/1184870207262613505,0,0
2019-10-17,16:34:00,wulei123,그리고 퀸덤과 녹두전을 챙겨보는 팅팅,https://twitter.com/wulei123/status/1184870186647801856,0,1
2019-10-17,16:33:37,zinzasae1997,퀸덤 이번 무대 봐야 하는데... 특히 이번엔 아이들 무대가 흥한 모양이군,https://twitter.com/zinzasae1997/status/1184870087179685888,1,3
2019-10-17,16:33:37,QD_Archive,퀸덤 8화&gt; 3차 경연 &lt;팬도라의 상자&gt; #1 - (여자)아이들 싫다고 말해 소연 GIF ,https://twitter.com/QD_Archive/status/1184870086131113984,18,26
2019-10-17,16:33:33,jcwchaewan,"마마무 사랑해, 평생 함께 하자.. 같이 10년! 20년! (늦은 재방보고 늦은 감동.. ) i miss you 원래도 좋았지만, 퀸덤에서 팬들을 위해 불러주는 의미가 나를 울컥시켰다.. 마마무 놓지않을게",https://twitter.com/jcwchaewan/status/1184870073049075712,0,0
2019-10-17,16:33:24,QD_Archive,퀸덤 8화&gt; 3차 경연 &lt;팬도라의 상자&gt; #1 - (여자)아이들 싫다고 말해 미연 GIF ,https://twitter.com/QD_Archive/status/1184870034641846272,28,44
2019-10-17,16:33:06,QD_Archive,퀸덤 8화&gt; 3차 경연 &lt;팬도라의 상자&gt; #1 - (여자)아이들 싫다고 말해 수진 GIF ,https://twitter.com/QD_Archive/status/1184869958049660929,67,41
2019-10-17,16:32:53,makan_0603,퀸덤에 흐드러지는 편,https://twitter.com/makan_0603/status/1184869902013714432,0,1
2019-10-17,16:32:52,QD_Archive,퀸덤 8화&gt; 3차 경연 &lt;팬도라의 상자&gt; #1 - (여자)아이들 싫다고 말해 슈화 GIF ,https://twitter.com/QD_Archive/status/1184869898939330560,17,11
2019-10-17,16:32:47,Seoyunabar,#AOA #서유나 #유나 #SeoYuna #Yuna #퀸덤 #Queendom #AOA #Mnet ,https://twitter.com/Seoyunabar/status/1184869878357872641,13,18
2019-10-17,16:32:33,ALL_rofan_D,오늘 퀸덤 대박이었어요?? 기자 끝내거 왔는데 아이들언니들 실트야...!!,https://twitter.com/ALL_rofan_D/status/1184869819201404928,0,1
2019-10-17,16:32:12,Seoyunabar,#AOA #서유나 #유나 #SeoYuna #Yuna #퀸덤 #Queendom #AOA #Mnet 어떤 식으로 널 혼낼까,https://twitter.com/Seoyunabar/status/1184869732031197185,9,18
2019-10-17,16:32:12,kim_coral124,앙녕하세요~~~ 저는 걸그룹을 조아하지만? 남돌칭긔들이 더 많은 사람입니다~~ 요즘은 퀸덤 봄 이사람은 제 최애입니다 이뻐해주세요 ,https://twitter.com/kim_coral124/status/1184869729866940421,0,0
2019-10-17,16:32:07,_d_lang,폰뺐겨서공기계로 겨우 들어왔다ㅜㅜ오늘 퀸덤도...시밬 역대급,https://twitter.com/_d_lang/status/1184869709889429505,0,0
2019-10-17,16:31:53,QD_Archive,퀸덤 8화&gt; 3차 경연 &lt;팬도라의 상자&gt; #1 - (여자)아이들 싫다고 말해 우기 GIF ,https://twitter.com/QD_Archive/status/1184869650485501952,29,24
2019-10-17,16:31:12,coque_Nyang,퀸덤 오져서 트이타 안 올 수가 없잖아요 여돌 안 먹는 줄 알았는데 사실 처돌이였어 난 아이들에게 미쳤어,https://twitter.com/coque_Nyang/status/1184869481970946050,0,0
2019-10-17,16:31:12,_neljhQ,[8회] ♬ I Miss You - 마마무 @3차 경연 팬도라의 상자 컴백전쟁 : 퀸덤 8화 https://youtu.be/IjEue6SqJjI ไม่ได้ฟังเพลงนี้มานานมาก ขนลุกตั้งแต่ฮวีอินเปิดโน้ตแรก กัมจองmax,https://twitter.com/_neljhQ/status/1184869479055912960,1,0
2019-10-17,16:30:53,vvviiiixxxxx,아 마마무 노래 진짜 미쳤다 너무 잘해 무무 무무 무무 하면서 영상 나올때 왈칵 아 퀸덤 너무....좋아.....,https://twitter.com/vvviiiixxxxx/status/1184869401528418305,0,0
2019-10-17,16:30:40,Seoyunabar,#AOA #서유나 #유나 #SeoYuna #Yuna #퀸덤 #Queendom #AOA #Mnet 질투 나요 ,https://twitter.com/Seoyunabar/status/1184869347073806336,26,50
2019-10-17,16:30:27,QD_Archive,퀸덤 8화&gt; 3차 경연 &lt;팬도라의 상자&gt; #1 - (여자)아이들 싫다고 말해 민니 GIF ,https://twitter.com/QD_Archive/status/1184869290584899584,115,96
2019-10-17,16:30:08,NO12o8,퀸덤 좀 참고 다음에 봐야지,https://twitter.com/NO12o8/status/1184869212235321344,0,1
2019-10-17,16:30:03,pic_ye,이번 퀸덤 마마무 무대는 더이상 순위따위 연연하지 않게 해줬다ㅠㅠ 아니야 그래도 일등 만들어주고 싶어ㅠㅠ,https://twitter.com/pic_ye/status/1184869192039723009,0,1
2019-10-17,16:29:50,oiimo_,퀸덤7화 식스퍼즐 파워무대 봐주셔야,https://twitter.com/oiimo_/status/1184869136742019073,0,0
2019-10-17,16:29:43,AHJ0723,191017 퀸덤 #마마무 #화사 http://bit.ly/31mVDTr,https://twitter.com/AHJ0723/status/1184869106933211136,146,320
2019-10-17,16:29:40,Seoyunabar,#AOA #서유나 #유나 #SeoYuna #Yuna #퀸덤 #Queendom #AOA #Mnet 너무 예뻐 ,https://twitter.com/Seoyunabar/status/1184869095025471488,8,14
2019-10-17,16:29:26,mmmmss95,그리고 퀸덤에서 마마무 무대 정할때 불후의명곡 언급된거 좋았다 ㅋㅋㅋㅋ 따라올수없는 아이돌 커리어 중 하나지 보컬 넘사그룹 마마무 목소리가 곧 퍼포먼스 보컬퍼포먼스 무슨 상 받은적 있던고같은데,https://twitter.com/mmmmss95/status/1184869034568798209,3,11
2019-10-17,16:28:37,dobbyneedsocks,"퀸덤덕분에 아이돌판 머..무대머...누군지도모르겟거,,,,햇엇는데 매번 눈",https://twitter.com/dobbyneedsocks/status/1184868830595600384,0,2
2019-10-17,16:28:05,moonP_haze,잠깐 퀸덤한시간 봤다가 그 얘기 조금 하다가 같이 사는 사람이랑 오늘 뭐했나 얘기좀 하고 트위터에 몇마디 했는데 엥 두시가 됐어요,https://twitter.com/moonP_haze/status/1184868696625311747,0,1
2019-10-17,16:28:01,ofcrsmy,..사실 퀸덤 8회 숨은 명장면 거울면임.. ,https://twitter.com/ofcrsmy/status/1184868679529332737,2,4
2019-10-17,16:27:51,zzomseng2,내일 교양수업 때 퀸덤 바야지,https://twitter.com/zzomseng2/status/1184868637812748288,0,0
2019-10-17,16:27:19,aabby0668,종이의집을 보고잘까 퀸덤을 보고잘까 트위터를 하다잘까,https://twitter.com/aabby0668/status/1184868502118653953,0,0
2019-10-17,16:27:15,Berrysoojin,큐브 아이들 퀸덤 내보낸거 너무너무 잘했어 근데 물들어올때 아이톡이랑 응원봉 굿즈좀 내주라 응..? 아이들 이렇게 열일하는데 노좀 저어줘 진짜...,https://twitter.com/Berrysoojin/status/1184868483906932738,24,50
2019-10-17,16:26:59,wheeeena,내일 교육있지만 쳐 안자고 빨리 퀸덤봐야지 무대갈증나,https://twitter.com/wheeeena/status/1184868420384223234,0,0
2019-10-17,16:26:59,kpqeen,퀸덤 보다가 소름돋았어요...컨셉 표현하기 힘들었을텐데...너무잘했어ㅡㅡㅜㅜㅡㅜㅜㅜㅜ엉엉,https://twitter.com/kpqeen/status/1184868420044517376,0,1
2019-10-17,16:26:55,mydream_Billion,내일 퀸덤봐야지~ ,https://twitter.com/mydream_Billion/status/1184868401929318406,0,0
2019-10-17,16:26:45,lovelyz_mylove,퀸덤 파이널방청 링크좀,https://twitter.com/lovelyz_mylove/status/1184868358266556416,0,0
2019-10-17,16:26:42,iwantsomeeasyid,와 진짜 와 퀸덤 무대 아미슈 와,https://twitter.com/iwantsomeeasyid/status/1184868345830526976,0,0
2019-10-17,16:26:39,_iwant2gohome,퀸덤에 티아라 나오면 데바데 크라이크라이 티티엘 다 보고싶지만 .. 거짓말 존나 사랑했어서 거짓말 너무 보고싶음 ㅠ,https://twitter.com/_iwant2gohome/status/1184868335512502272,1,1
2019-10-17,16:26:32,On17da,낌혲낌 : 퀸덤이 끝내도 우리가 한다 ,https://twitter.com/On17da/status/1184868303560331271,0,5
2019-10-17,16:26:09,ming_is_free,ㅠ나도 보고싶어 퀸덤,https://twitter.com/ming_is_free/status/1184868207347159040,0,0
2019-10-17,16:26:07,yuqi_love_0923,GIF 우기 움짤 -퀸덤 -(여자)아이들 -싫다고말해 #퀸덤 #여자이이들 #우기,https://twitter.com/yuqi_love_0923/status/1184868200564940806,7,12
2019-10-17,16:26:04,MiracleSinB,OMG just saw this 3sec of Mimi x YooA!! Mimi being YooA’s pillow &amp; YooA being like a baby to Mimi ㅋㅋㅋ Mimi’s expression... HAHA The way YooA clinging on Mimi 김미현에 집착하는 유시아~ 95’쯔 #YooA #Mimi #Ohmygirl #queendom #퀸덤 #오마이걸 #유아 #미미 #김미현 #유시아,https://twitter.com/MiracleSinB/status/1184868189282242560,109,194
2019-10-17,16:25:45,I_Demeanor,목요일 원래 약간 월요일 같은 느낌으로 볼 거 없었는데 무슨일이야 드라마2개에 퀸덤까지 다 봐버렸잖아,https://twitter.com/I_Demeanor/status/1184868107749220352,0,1
2019-10-17,16:25:18,Ra__sol,아이들 퀸덤에서 싫다고 말해? 그거 무대한 거 유튜브에서 봤는데 완전 대박인데여? 지린다;;,https://twitter.com/Ra__sol/status/1184867995014713344,0,0
2019-10-17,16:25:15,SOMGIDLE,역시 퀸덤 전에 공부를 다 했었어야했는데 놀고 자다가 망햇네 ^^ㅎㅎ,https://twitter.com/SOMGIDLE/status/1184867983060959232,0,0
2019-10-17,16:25:13,ahcahc0,퀸덤 이번 주제도 대박이다..,https://twitter.com/ahcahc0/status/1184867975947419648,0,0
2019-10-17,16:25:00,Shounghwa,[ENG sub] [4회] ♬ Fire - (여자)아이들 @2차 경연 커버곡 대결 컴백전쟁 : 퀸덤 4화 https://youtu.be/Og_X5gTXTF0 via @YouTube #GIDLE I love them !,https://twitter.com/Shounghwa/status/1184867918137438208,0,0
2019-10-17,16:24:23,sysnumberone,마마무를 왜 좋아하는지 묻는다면 암말 안하고 어제 퀸덤 무대 보여줄거야 ,https://twitter.com/sysnumberone/status/1184867762608304130,0,1
2019-10-17,16:24:13,profitezdu,여돌계 하트시그널 퀸덤 보세요 ,https://twitter.com/profitezdu/status/1184867723018293248,0,0
2019-10-17,16:23:57,oxygen_0701,"마마무 무대 얼마나 오지면 실트 가는 거지,? 보고싶은데 휴대폰으로 보면 그,, 아무튼 응 그런 거 아무튼,,,,, 퀸덤 덕분에 실트 자주 올라가는 거 보고 뿌듯한 오타쿠",https://twitter.com/oxygen_0701/status/1184867655129300994,0,4
2019-10-17,16:23:33,soo_zxzx,퀸덤 끝나면 일요일에 개콘 끝나고 밴드음악 들을 때 느낌나...,https://twitter.com/soo_zxzx/status/1184867556068167680,0,0
2019-10-17,16:23:28,_BB_vivi,"[8회] ♬ 싫다고 말해(Nightmare Ver.) - (여자)아이들 @3차 경연 팬도라의 상자 (출처 : 컴백전쟁 : 퀸덤 | 네이버TV) http://naver.me/FX5DbZLH 님들 이거봐주세요 진자 대쩐다 몰입하게되는,,, 근데 약간 그로테스크..(?)하대요 주의주의",https://twitter.com/_BB_vivi/status/1184867533574131713,0,0
2019-10-17,16:23:24,OwO_Sonak,퀸덤볼때마다 승희 리액션이 너무 귀여워ㅠㅠㅠㅠㅠㅠㅠㅠㅠ사랑스럽다 승희야ㅠㅠㅠ,https://twitter.com/OwO_Sonak/status/1184867516335525888,0,0
2019-10-17,16:23:11,naaatehh,퀸 덤 사 랑 해 너 무 조 아,https://twitter.com/naaatehh/status/1184867462820446208,0,0
2019-10-17,16:22:42,hoshininaru8212,[8회] ♬ 싫다고 말해(Nightmare Ver.) - (여자)아이들 @3차 경연 팬도라의 상자 컴백전쟁 : 퀸덤 8화 https://youtu.be/TorT6Rgl-Kc via @YouTube アイドゥルちゃんたち凄すぎて、言葉が出なかった…表情がもう,https://twitter.com/hoshininaru8212/status/1184867342611705856,0,0
2019-10-17,16:22:15,waquaric,질투나요 베이비 신나서 노동요로 되게 좋아하던 곡인데 퀸덤에서 이 곡도 했었구나ㅠ,https://twitter.com/waquaric/status/1184867227465437185,0,0
2019-10-17,16:22:12,pockyjunk,다들.. 아이들퀸덤무대 꼭봐야해.. 수진씨가 표현하는 슬픔을 봐조,https://twitter.com/pockyjunk/status/1184867214911889408,0,1
2019-10-17,16:21:55,03_0gu,마마에서 퀸덤 콜라보 무대 올려주기 마마에서 퀸덤 싱글곡들 무대 올려주기,https://twitter.com/03_0gu/status/1184867144208535554,0,1
2019-10-17,16:21:01,smilevvsmilevv,รู้จักความ elegance vocal queen น้อยแต่มากปะ แบบมันดีอะ ไม่ต้องพูดเยอะ ไม่มีเสียงจะพูดเพราะสะอื้นร้องไห้น้ำตาไหลไปหมดแล้ว [풀버전] ♬ I Miss You - 마마무 @3차 경연 컴백전쟁 : 퀸덤 8화 https://youtu.be/3ELYg8XilJY via @YouTube,https://twitter.com/smilevvsmilevv/status/1184866918538178561,0,0
2019-10-17,16:20:07,_primusamor,오마걸 너무 좋은거같음.... 퀸덤 나온거 되게 잘한 거 같구 잘됐으면 좋겠어 진짜 너무 좋아...,https://twitter.com/_primusamor/status/1184866690263330818,0,0
2019-10-17,16:20:01,03_0gu,생각하니까 퀸덤 파이널 생방 아니야? 31일에 하는 거 같은데 뭐임 다음주에 남은 팀들 하고 다다음주는 뭐야,https://twitter.com/03_0gu/status/1184866665349038080,0,2
2019-10-17,16:19:37,__feelgood__,퀸덤 보면서 요즘 가장 많이 하는 생각은 너는 팬들을 존재를 지금도 소중히 생각하고 있을지.,https://twitter.com/__feelgood__/status/1184866566829035522,0,0
2019-10-17,16:19:14,kanggkkang,퀸덤 왤케 재밌어요,https://twitter.com/kanggkkang/status/1184866468321644544,0,0
2019-10-17,16:18:55,QD_Archive,퀸덤 8화&gt; 3차 경연 &lt;팬도라의 상자&gt; #1 - (여자)아이들 싫다고 말해 (2) ,https://twitter.com/QD_Archive/status/1184866390173339648,58,45
2019-10-17,16:18:25,tara_chichi,"아이들무대 뭐야..? 대박...ㅜㅜ 아무래도 나 퀸덤때문에 아이들 입덕한 것 같은데, 민니 수진 너무 좋은데...ㅜ ",https://twitter.com/tara_chichi/status/1184866264465821696,0,2
2019-10-17,16:18:17,ant0n02,3. 아이들 무대 and 17. 퀸덤 아이들,https://twitter.com/ant0n02/status/1184866228265017346,1,4
2019-10-17,16:17:56,saeji_x3,아 미친 자려고 했는데 결국 송우기 움짤 봐버렸고 미친여자를 사랑하는 이새지 당장 퀸덤 다시보기로 보러간다,https://twitter.com/saeji_x3/status/1184866139911815168,0,5
2019-10-17,16:17:44,SOMGIDLE,퀸덤에 아이들 무대 볼때마다 놀란다...ㅜㅜ 콘서트 꼭 가보고 싶다 부모님이 안 보내주실거 같은데ㅜ,https://twitter.com/SOMGIDLE/status/1184866092511924225,0,1
2019-10-17,16:17:39,MOONN_SET,아이들이랑 에이오에이가 퀸덤 화제성은 끌고가는구나 기존에없던거하는그룹과 기존컨셉에서 벗어난그룹 근데 오늘 마마무 착장 너무 취향인데 곡도 너무 가을가을하고 눈물찔끔나고 영상다운받아야지 힝,https://twitter.com/MOONN_SET/status/1184866068885426176,0,0
2019-10-17,16:17:34,NYOJJI_N,와씨 퀸덤 여자아이들 무대 유툽 올라왓길래 봣는데 ㅁㅊ 개오졌어 미친거 아냐 대박이다,https://twitter.com/NYOJJI_N/status/1184866049340014592,0,0
2019-10-17,16:17:14,_primusver,근데왜 랩 혜정장군이 안하고 소속사 후배남돌을 끼워판 것인지ㅡㅡ 제목부터 퀸덤인데 어딜감히 남자가 마이크를 잡는지?? 갓지민디바와 혜정장군 둘이서 했으면 신나서 백팔배를 올렸을텐데 남자가 껴서 107배 하고 잠깐 멈췄잔어,https://twitter.com/_primusver/status/1184865965831360512,0,0
2019-10-17,16:16:48,fate_SY_613,퀸덤 무대보고 충격받아서 공부 못하겠다. //^^//,https://twitter.com/fate_SY_613/status/1184865855269531651,0,0
2019-10-17,16:16:39,QD_Archive,퀸덤 8화&gt; 3차 경연 &lt;팬도라의 상자&gt; #1 - (여자)아이들 싫다고 말해 (1) 아래에 작사작곡편곡 소연 써있는 거 진짜 천재... ,https://twitter.com/QD_Archive/status/1184865816438640641,187,110
2019-10-17,16:16:35,_koshasha,퀸덤 이번꺼는 직캠업나 ㅠㅠ,https://twitter.com/_koshasha/status/1184865803293741056,0,0
2019-10-17,16:16:02,perfxlight09,[8회] ♬ 싫다고 말해(Nightmare Ver.) - (여자)아이들 @3차 경연 팬도라의 상자 컴백전쟁 : 퀸덤 8화 https://youtu.be/TorT6Rgl-Kc via @YouTube wowww g-idle is at another level wowww just wowww ,https://twitter.com/perfxlight09/status/1184865663568859137,0,0
2019-10-17,16:15:46,V1WMC,yall please click and watch. the numbers are a bit embarrassing. [8회] ♬ 질투 나요 BABY+T4SA+Puss - AOA @3차 경연 팬도라의 상자 컴백전쟁 : 퀸덤 8화 https://youtu.be/nKyi-04uzCo via @YouTube,https://twitter.com/V1WMC/status/1184865596887797760,2,1
2019-10-17,16:15:33,yongplicana,จะร้องไห้ ซึ้งอะ รักพวกคุณมากๆนะ [풀버전] ♬ I Miss You - 마마무 @3차 경연 컴백전쟁 : 퀸덤 8화 https://youtu.be/3ELYg8XilJY via @YouTube,https://twitter.com/yongplicana/status/1184865539618816001,0,1
2019-10-17,16:15:11,3316_0807,에오에 지민 너무 멋있어 방금 퀸덤 보고옴,https://twitter.com/3316_0807/status/1184865448149413888,0,0
2019-10-17,16:15:02,supermitm,와 퀸덤.........! ,https://twitter.com/supermitm/status/1184865412137111552,0,1
2019-10-17,16:15:01,TAEKWONMOO,지금까지 퀸덤도 못보고 공부하다가 지금 탐라에서 나만 뒤늦게 앓고있어ㅠㅠ,https://twitter.com/TAEKWONMOO/status/1184865409285017600,0,1
2019-10-17,16:14:44,diceroll_nub,근데왜 랩 혜정장군이 안하고 소속사 후배남돌을 끼워판 것인지ㅡㅡ 제목부터 퀸덤인데 어딜감히 남자가 마이크를 잡는지?? 갓지민디바와 혜정장군 둘이서 했으면 신나서 백팔배를 올렸을텐데 남자가 껴서 107배 하고 잠깐 멈췄잔어,https://twitter.com/diceroll_nub/status/1184865335888896001,0,4
2019-10-17,16:14:25,FaRTfARTee,"에오에는 진짜 개쩔었죠 하나의 무대로 기존 그들이 갖고 있던 그룹의 편견을 깨버렸어요. 이걸 기회로 다음 컴백 때는 또 어떤 모습으로 다가올지 기대도 되고 걱정도 되고,, 컨셉이 바뀌지 않더라도 대중들이 보는 시선은 바뀌겠죠? 넘 두근세근 그러니 앰넷은 퀸덤2 하라!",https://twitter.com/FaRTfARTee/status/1184865257946140672,0,0
2019-10-17,16:14:24,gam_jolim,나랑 퀸덤 제작진 욕하고 무대 울면서 감상 나눌 친구 필요해,https://twitter.com/gam_jolim/status/1184865250698391552,0,0
2019-10-17,16:14:18,BTS_aal,마마무 무대만 봐야지 했는데 한시간동안 퀸덤 무대들 정주행함..,https://twitter.com/BTS_aal/status/1184865225708720134,0,1
2019-10-17,16:14:02,min_lulu_,"마자요 유튜브 관련 동영상 늪에 빠지면 못 나와요 진짜루 ㅜ 퀸덤,, 시즌 39까지 해 주세요,,,",https://twitter.com/min_lulu_/status/1184865161502347265,0,1
2019-10-17,16:13:43,BloodyPena,[8회] ♬ I Miss You - 마마무 @3차 경연 팬도라의 상자 컴백전쟁 : 퀸덤 8화 https://youtu.be/IjEue6SqJjI - /กลายเป็นไชเท้าต้มเค็มไปแล้วคุณขาㅠㅠㅠㅠㅠㅠㅠㅠㅠㅠㅠㅠㅠㅠㅠㅠㅠ,https://twitter.com/BloodyPena/status/1184865079499489280,0,0
2019-10-17,16:13:31,youth__00,퀸덤 개오졌다 진짜,https://twitter.com/youth__00/status/1184865029251747840,0,4
2019-10-17,16:13:29,helloworldendl,퀸덤 자체가 박봄한테 너무 불리한듯,https://twitter.com/helloworldendl/status/1184865022821851137,0,1
2019-10-17,16:12:39,HONEYSTARBYUL,@AkfVttQy1z018cO 몽몽님 안녕하세요. 퀸덤 보고 입덕하셨다니!!! 무밭에 오신걸 환영합니다~,https://twitter.com/HONEYSTARBYUL/status/1184864809851879425,0,0
2019-10-17,16:12:08,zebi_yeon,퀸덤 영상 낮에보려고 하나도 안보고있는데 보고싶어 으악 보면 못잘것같아 헝 자야지,https://twitter.com/zebi_yeon/status/1184864681988476929,0,0
2019-10-17,16:12:06,milkyway808,맘무 팬들 퀸덤 보면서 안 우럿냐.. 나도 눈물나는데.. ㅜ,https://twitter.com/milkyway808/status/1184864673893515264,0,0
2019-10-17,16:11:54,mylight506_B,퀸덤 존잼... 오마이걸 무대 얼른 보고 싶다,https://twitter.com/mylight506_B/status/1184864624828506113,0,0
2019-10-17,16:11:49,FF14_milpon,퀸덤에 씬님 나오는데??????,https://twitter.com/FF14_milpon/status/1184864603177508865,0,0
2019-10-17,16:11:38,FF14_milpon,?퀸덤 씬님 초청한거임????,https://twitter.com/FF14_milpon/status/1184864554531995648,0,0
2019-10-17,16:11:28,kkkkkeyaki46,에오에 퀸덤 우승 힘들겠지... 이렇게 된 이상 퀸블리즈 우승 가자,https://twitter.com/kkkkkeyaki46/status/1184864515290066944,0,0
2019-10-17,16:11:03,whdtj96,여태컷 했던 퀸덤 무대중 제일 취향 저격.. 에오에 너나 해도 좋았지만 이 무대는 진짜 컵셉돌을 사랑하는 나에게 최고의 무대,https://twitter.com/whdtj96/status/1184864409610420224,0,0
2019-10-17,16:10:53,marshmell_,아. 아이돌 하나도 몰랐는데. 퀸덤 정말 멋있다. 너무 멋있어서 이 감격스러운 마음을 어디에라도 쓰고싶다. 여자들 이렇게 소름끼치게 멋있을 때 진짜 눈물콸콸소름감동. 무랑 마이걸이랑 아이들 아오아 러블리 등등 엉엉 아내랑 모든 멤버들을 앓고 있다. 많이 많이 찢어주세요 ,https://twitter.com/marshmell_/status/1184864368116133888,0,26
2019-10-17,16:10:50,underthedal_,퀸덤 아이들 미쳤다 흑흑 싫다고 말해 첨 들었는데 원래 버전도 좋고 나이트메어 버전도 좋아....소연 정말 천재 맞아...그리고 그거 무대에서 찰떡같이 소화해내는 아이들 대천재 짱짱...,https://twitter.com/underthedal_/status/1184864354732085248,0,0
2019-10-17,16:09:37,Berrysoojin,퀸덤 짱 큐브 짱 사랑해 아이톡 리얼리티 응원봉 굿즈만 만들어줘,https://twitter.com/Berrysoojin/status/1184864049621680128,0,2
2019-10-17,16:09:32,diceroll_nub,나아직 에오에이 무대만 봣어..... 왜냐면.... 퀸덤은 출연진들의 기량이 너무나 출중한 나머지 그룹별로 무대 하루씩은 배당해서 돌아가면서 앓아야됨 그렇게 두바퀴 사이클 돌면 일주일 지나서 또 새 무대 공급됨,https://twitter.com/diceroll_nub/status/1184864025709989890,0,1
2019-10-17,16:09:21,G_I_DLEb,[ ] 20191017 @컴백전쟁 : #퀸덤 아이들 싫다고 말해 무대 좋다고 말해 표정연기 하나까지 섬세함이 느껴지는 그야말로 소름 돋는 무대였습니다! 18일 정오에 공개되는 '#싫다고말해 (Nightmare Version)' 음원도 많은 사랑 부탁드립니다 #여자아이들 #G_I_DLE #Mnet #Queendom,https://twitter.com/G_I_DLEb/status/1184863980650516480,17,34
2019-10-17,16:09:16,vinhpham2211, #AOA #Jimin #Queendom #AOAQueendom #지민 #유나 #혜정 #설현 #찬미 #퀸덤 ,https://twitter.com/vinhpham2211/status/1184863962044620800,0,4
2019-10-17,16:09:12,L5v24ever,마마무 아이미스유는 워낙 좋아하는 노래라 자주 듣는데 내가 이걸 퀸덤에서 보게 될 줄이야... 행복... ~~~도~~~ 하는 부분에 그 이어서 고음 끌고 가는 힘이 휘인도 솔라도 너무 좋고 ㅠㅠ 긍데 진짜 팬 위한 무대다 이 노래 좋아하고 마마무 응원하는 나도 울컥 오르는 노래인데 팬들은 얼마나...,https://twitter.com/L5v24ever/status/1184863943002484742,0,0
2019-10-17,16:07:59,profitezdu,미친 어하루작가 드라마 끊는게 선수네 아주 (퀸덤보느라 이제본),https://twitter.com/profitezdu/status/1184863636503707648,0,0
2019-10-17,16:07:56,valuable0829,오늘도 퀸덤이 다 뒤집어놨구나,https://twitter.com/valuable0829/status/1184863625753714688,0,0
2019-10-17,16:07:53,supermitm,퀸덤 존나재밌다 이 멤버로 평생해주라 제발제발제발제발,https://twitter.com/supermitm/status/1184863610582908929,0,0
2019-10-17,16:07:52,tae_yong71,퀸덤본다고 자는 시간놓쳤더니 ....... 잠들기싫다,https://twitter.com/tae_yong71/status/1184863609089748993,0,0
2019-10-17,16:07:52,Tirbyul_IUlN,딱 저번주와 오늘 퀸덤의 갭 ,https://twitter.com/Tirbyul_IUlN/status/1184863606996779008,0,0
