date,time,user_name,text,link,retweet_counts,favorite_counts
2019-10-17,13:47:26,alongyein0604,저 귀여운 정예인을 보고도 일주일을 더 기다리라고? 걍 방송 한시간 더 해 퀸덤 이새기들아,https://twitter.com/alongyein0604/status/1184828268496572422,0,0
2019-10-17,13:47:19,ma_zzzzzz,퀸덤 등수 맘에 안들어서 안볼란다 ㅡㅡ,https://twitter.com/ma_zzzzzz/status/1184828239363002369,0,1
2019-10-17,13:47:19,jaehee1130,으아악이제서야 퀸덤 틀엇어,https://twitter.com/jaehee1130/status/1184828239245533185,0,0
2019-10-17,13:47:19,lg_ham0289__,무어? 퀸덤 안봐서 모르는데 유아언니 1등했어??? ㅠ웅 우리 옴걸 유아언니 최고야ㅠㅠ ,https://twitter.com/lg_ham0289__/status/1184828239132250112,0,0
2019-10-17,13:47:18,Omg_mamma,"솔직히 퀸덤에서 오마이걸 리액션상 줘야댐,,",https://twitter.com/Omg_mamma/status/1184828231242772480,0,6
2019-10-17,13:47:02,9xo9xo,퀸덤 개꿀잼..,https://twitter.com/9xo9xo/status/1184828165996154880,0,1
2019-10-17,13:46:59,RBW_MAMAMOO,[#마마무] '포X몬이 왜 거기서 나와?..' 비글미 낭낭한 마마무 선곡회의 http://naver.me/xWFx5HNj #MAMAMOO #퀸덤,https://twitter.com/RBW_MAMAMOO/status/1184828153404878848,1633,5263
2019-10-17,13:46:55,a0520exol,"타돌언급 진짜 죄송한데 오늘 퀸덤 아이들 분들 무대 진짜 대박이다,,, 5분동안 숨도 못 쉬고 멍하니 보기만 함 다들 함 보시면 절대 후회 안 하실 거에요",https://twitter.com/a0520exol/status/1184828135021281281,1,5
2019-10-17,13:46:50,MZozNNH5Uc1ZBhk,여러분퀸덤보시나여대유잼 #엑스원_셀프캠 #X1_Selfcam 퀸덤재밌어셀프캠도재밌어,https://twitter.com/MZozNNH5Uc1ZBhk/status/1184828115777802242,19,17
2019-10-17,13:46:44,RBW_MAMAMOO,"[#화사] '김밥 받아줘서 고마워 ' 너는 김, 나는 밥! 이제는 친구가 된 구오 http://naver.me/5wbj2Jy7 #HWASA #퀸덤",https://twitter.com/RBW_MAMAMOO/status/1184828090356158469,1557,5518
2019-10-17,13:46:39,self_modify,오 ㅋㅋㅋ 난 퀸덤 보고 아이들 입덕함 수진 씨 fire 공연할때 장난아냐 진짜 장난아냐,https://twitter.com/self_modify/status/1184828068508028928,0,0
2019-10-17,13:46:39,Its_my_park,퀸덤 본방때는 화질이 너무 구져서 무대 화면은 안보고 귀만 들음... 보는건 프레시한 눈으로 이따 유튭서 봐야지.,https://twitter.com/Its_my_park/status/1184828068466049024,0,0
2019-10-17,13:46:36,MnetKR,[퀸덤/8회] '컨셉과 찰떡' 레드레드한 슬픔 속의 분노 메이크업 K-POP 여왕의 자리를 두고 펼쳐지는 #걸그룹 #컴백 전쟁! Mnet ‘퀸덤(Queendom)’ #AOA #여자아이들 #러블리즈 #마마무 #오마이걸 #박봄 #Mnet ‘#퀸덤(#Queendom)’ 매주 목요일 밤 9시 20분 본방사수,https://twitter.com/MnetKR/status/1184828057778937856,253,1337
2019-10-17,13:46:30,spring_056_780,네가 처음 불러준 내 이름 쉴 틈 없이 달려오느라 다 담아내지 못한 나의 기억의 필름 내 사계절을 만들어준 너의 체온 가득 후회없이 어제를 살고 오늘을 웃어 내일의 너 나 우리를 그리워하며 - 퀸덤에서 문별이가 직접 작사한 랩부분 가사,https://twitter.com/spring_056_780/status/1184828031472291845,0,1
2019-10-17,13:46:27,nabiyojung0417,마마무 감동무대리스트에 추가된 오늘 191017 퀸덤...,https://twitter.com/nabiyojung0417/status/1184828017299734529,0,1
2019-10-17,13:46:26,bing_bong1214,으악 방석 풀엇네 시발 나 죽고싶어 퀸덤 너무 좋아 사망,https://twitter.com/bing_bong1214/status/1184828014716043265,0,0
2019-10-17,13:46:26,_yw_moon,퀸덤 진짜 내 마음은 울었어 눈으로 안울어서 그러ㅎ지,https://twitter.com/_yw_moon/status/1184828013109628929,0,2
2019-10-17,13:46:20,allyur_twit,퀸덤 무대에 남자 못 올리는 법 만들기 운동,https://twitter.com/allyur_twit/status/1184827991362158592,0,1
2019-10-17,13:46:19,system_of_SOLAR,9시 20분이면 ‘퀸덤 할 시간이네...’ 하면서 야자실에 앉아 아련하게 시계를 쳐다보는 나,https://twitter.com/system_of_SOLAR/status/1184827984726740993,0,0
2019-10-17,13:46:13,tomindcactus,[8회] ♬ 싫다고 말해(Nightmare Ver.) - (여자)아이들 @3차 경연 팬도라의 상자 (출처 : 컴백전쟁 : 퀸덤 | 네이버TV) ,https://twitter.com/tomindcactus/status/1184827962002034688,0,0
2019-10-17,13:46:10,NotMichaelButch,나지금완전퀸덤과몰입녀,https://twitter.com/NotMichaelButch/status/1184827948529934337,0,1
2019-10-17,13:46:08,BTSweetbom,허엉 오늘 퀸덤 마마무 무대 진짜 좋다 내가 다 눈물나(ᵕ̣̣̣̣̣̣﹏ᵕ̣̣̣̣̣̣) 가수랑 팬 사이에 유대감이 느껴질 때 진짜 감동스러운 것 같아. 서로에게 서로가 소중한 존재라는 걸 다시한번 느끼는 그 때. 얼른 럽파콘 보고싶댜 나도 빨리 내가수 무대 보고싶오,https://twitter.com/BTSweetbom/status/1184827941588361216,1,11
2019-10-17,13:46:04,moonwhee417,[8회] ♬ I Miss You - 마마무 @3차 경연 팬도라의 상자 컴백전쟁 : 퀸덤 8화 https://youtu.be/IjEue6SqJjI via @YouTube,https://twitter.com/moonwhee417/status/1184827924664336384,0,0
2019-10-17,13:46:04,white_cherry_9,나도 퀸덤 볼래 엠넷 토요일 일곱시에 퀸덤재방해줘,https://twitter.com/white_cherry_9/status/1184827923225726979,0,0
2019-10-17,13:46:01,MiracleSinB,OH MY GIRL ALL SO HAPPY when YooA revealed she is first 연기를 뭇 해 유시아 #OHMYGIRL #QUEENDOM #오마이걸 #퀸덤 ,https://twitter.com/MiracleSinB/status/1184827911217352705,28,74
2019-10-17,13:46:01,onmyown00,[8회] '뿌에엥ㅜ^ㅜ' 돌고래 사운드와 눈물이 넘치는 퍼포먼스 1위의 대기실 컴백전쟁 : 퀸덤 8화 https://youtu.be/TvbjER7cndw @YouTube 님이 공유 아이고 우리 샷샤 ㅜㅜ 고생햇어 ㅜㅜ,https://twitter.com/onmyown00/status/1184827909720039424,0,0
2019-10-17,13:45:53,mmyy95,[8회] ♬ I Miss You - 마마무 @3차 경연 팬도라의 상자 컴백전쟁 : 퀸덤 8화 https://youtu.be/IjEue6SqJjI ขนลุก ยอดมะนุ้ดเสม๋อ ,https://twitter.com/mmyy95/status/1184827878774435841,0,0
2019-10-17,13:45:50,U_myshiningstar,퀸덤 바보드라 방송 끝나자마자 음원을 풀어야지 오늘 밤새 듣고 울엇다 진짜,https://twitter.com/U_myshiningstar/status/1184827864362864640,44,137
2019-10-17,13:45:39,langju94,퀸덤 안봤지만 평생해줘 물론 여돌끼리만. 여돌들 경쟁 프레임 씌우지말고 하하호호 하게해야한다 뭔지ㅜ알지? 순위 다 필요없고 우리가 이렇게 대박이다 이런거만 보여줄수있게 해줘라,https://twitter.com/langju94/status/1184827819462840320,0,0
2019-10-17,13:45:39,NotMichaelButch,다음퀸덤에웆뀨가나오면은어떡하누어쩌누시발,https://twitter.com/NotMichaelButch/status/1184827817944481792,0,1
2019-10-17,13:45:33,wheein159,[8회] ♬ I Miss You - #마마무 @3차 경연 팬도라의 상자 컴백전쟁 : 퀸덤 8화 https://youtu.be/IjEue6SqJjI #MAMAMOO @RBW_MAMAMOO,https://twitter.com/wheein159/status/1184827791319162881,16,12
2019-10-17,13:45:24,junglyisreal,อย่างคุณภาพ โคตรหลอน วีคนี้ที่1ต้องมาแล้ว!!! [8회] ♬ 싫다고 말해(Nightmare Ver.) - (여자)아이들 @3차 경연 팬도라의 상자 컴백전쟁 : 퀸덤 8화 https://youtu.be/TorT6Rgl-Kc via @YouTube,https://twitter.com/junglyisreal/status/1184827754572681216,0,0
2019-10-17,13:45:14,lee_O_11,퀸덤 생방도 하려나?...,https://twitter.com/lee_O_11/status/1184827714206760960,0,0
2019-10-17,13:45:03,cheery_cw,아 지금 일어났어 퀸덤 못 봄 ㅅㅂ,https://twitter.com/cheery_cw/status/1184827666924331009,0,3
2019-10-17,13:44:58,12_3_4__bubble,퀸덤 존나 미쳣다구용...ㅠㅠ!!!,https://twitter.com/12_3_4__bubble/status/1184827646900748288,0,1
2019-10-17,13:44:57,BOKNAM_2E,나만 퀸덤 못봐 너무 슬 퍼,https://twitter.com/BOKNAM_2E/status/1184827641091641350,0,0
2019-10-17,13:44:57,nata_EYo,아 ㅅㅂ 못잔다 나 퀸덤 재방봐야함,https://twitter.com/nata_EYo/status/1184827640206675969,0,2
2019-10-17,13:44:55,MnetKR,[퀸덤/8회] 진격하는 혜정장군은 '사랑스러워'ㅣ퀸덤 방석 퀴즈 #3 K-POP 여왕의 자리를 두고 펼쳐지는 #걸그룹 #컴백 전쟁! Mnet ‘퀸덤(Queendom)’ #AOA #여자아이들 #러블리즈 #마마무 #오마이걸 #박봄 #Mnet ‘#퀸덤(#Queendom)’ 매주 목요일 밤 9시 20분 본방사수,https://twitter.com/MnetKR/status/1184827635509035008,75,324
2019-10-17,13:44:51,_mng__gxx,퀸덤 아이들 싫다고 말해 https://m.tv.naver.com/v/10466196,https://twitter.com/_mng__gxx/status/1184827617452556289,0,0
2019-10-17,13:44:51,bing_bong1214,앗 쉬빨 또 나만 못보는 퀸덤,https://twitter.com/bing_bong1214/status/1184827614935937025,0,0
2019-10-17,13:44:50,moodeodeok,"퀸덤 순기능 여돌 수록곡 보기,,,",https://twitter.com/moodeodeok/status/1184827611052068867,0,1
2019-10-17,13:44:48,_crescent_MOO_N,후회없이 어제를 살고 오늘을 웃어 내일의 너와나 우리를 그리워하며 [ I miss you (in퀸덤) 문별 랩 중 ] ,https://twitter.com/_crescent_MOO_N/status/1184827605758828544,4,14
2019-10-17,13:44:45,mmm_haessal,퀸덤 엄마랑 같이보고있는데 역시 가수는 노래를 잘해야지~ 한마디하셨다 ,https://twitter.com/mmm_haessal/status/1184827590319624192,0,3
2019-10-17,13:44:36,X_Phenomenon_,그냥 퀸덤2 나오면 청하 나오게 해줘 할미 소원은 그거뿐야,https://twitter.com/X_Phenomenon_/status/1184827553229312000,0,2
2019-10-17,13:44:33,Hoshijora_0419,퀸덤 조명 미쳤어??????????,https://twitter.com/Hoshijora_0419/status/1184827542823297024,0,1
2019-10-17,13:44:28,DD_177x154,ㅋ ㅋ ㅋㅋ ㅋ ㅋ ㅋ ㅋㅋ ㅋ ㅋ ㅋㅋ ㅋ 퀸덤봐??봐?,https://twitter.com/DD_177x154/status/1184827518232055810,0,0
2019-10-17,13:44:26,nyomnyomlife,시험공부 한다고 독서실 와서 퀸덤 못 보는데 정예인 왜 1등 아님...물론 다른분들도 다 잘하셨지만 정예인이 1등이어야할 무대라고.......ㅠㅠㅠㅠㅠㅠㅠㅠㅠ,https://twitter.com/nyomnyomlife/status/1184827513211482114,0,4
2019-10-17,13:44:25,kkomommma,[8회] ♬ I Miss You - 마마무 @3차 경연 팬도라의 상자 컴백전쟁 : 퀸덤 8화 https://youtu.be/IjEue6SqJjI via @YouTube,https://twitter.com/kkomommma/status/1184827506081202176,0,0
2019-10-17,13:44:23,bear3155,다히 보려고 퀸덤 보다가 다른 분들한테도 치이고 있어.... 하....,https://twitter.com/bear3155/status/1184827501031243777,0,3
2019-10-17,13:44:23,white_cherry_9,아이들 노랜데 퀸덤에서 했나봐ㅜㅠㅠ,https://twitter.com/white_cherry_9/status/1184827500825702400,0,0
2019-10-17,13:44:22,WhiteLionleoleo,퀸덤 보는 누나들 사이에서 잠자는 울애기 ,https://twitter.com/WhiteLionleoleo/status/1184827495700254721,0,7
2019-10-17,13:44:22,eyesonme_1029,와 퀸덤 미쳤다 하,https://twitter.com/eyesonme_1029/status/1184827493955489792,0,1
2019-10-17,13:44:20,17nim_m,ทาชิ อินสตาแกรม อินสตาแกรม ฮาเน [MPD직캠] (여자)아이들 민니(아아) 직캠 4K 'instagram' (MINNIE FanCam) | @퀸덤_2019.10.10 ,https://twitter.com/17nim_m/status/1184827486632173568,0,0
2019-10-17,13:44:14,X_Phenomenon_,퀸덤의 최종 목표는 아오아 컴백쇼 아님?,https://twitter.com/X_Phenomenon_/status/1184827463030865920,1,1
2019-10-17,13:44:13,blackwatchdiary,그냥 2019 마마는 퀸덤인걸로 합시다 ㅋㅋㅋㅋㅋ,https://twitter.com/blackwatchdiary/status/1184827456999419904,0,0
2019-10-17,13:44:10,Hoshijora_0419,아니 퀸덤 조명 실화냐고요 지금 혜정장군님 해리포터에 소리지르는 뭐시기드레이크처럼 보이는데요 시발,https://twitter.com/Hoshijora_0419/status/1184827445720993793,0,1
2019-10-17,13:44:09,Soon_Baek__,저 퀸덤 보구 있성요!!,https://twitter.com/Soon_Baek__/status/1184827440314478592,0,0
2019-10-17,13:44:03,MMMJJUI,진짜 내가 퀸덤 시작하기전에 갑자기 막 노래해줘서 고맙다고 무대해줘서 고맙다고 생각만 했는데 눈물이 나는거야 근데 무대 보고나니까 아까 생각했던거까지 다 끌고와서 너무 벅차올라서 그냥,https://twitter.com/MMMJJUI/status/1184827416486612992,0,8
2019-10-17,13:44:00,Novemberr5th,얘들아 진짜 퀸덤이 예능이니? 어워드쇼지???,https://twitter.com/Novemberr5th/status/1184827404268625924,0,1
2019-10-17,13:44:00,ryulee0112,솔직히 퀸덤현장 투표 너무 팬빨인거 보여서 걍 그래...ㅠ,https://twitter.com/ryulee0112/status/1184827402062446592,0,0
2019-10-17,13:43:57,LovelyJiae521,퀸덤 한시간만 더 방송해 러블리즈 카메오 보여줘 당장,https://twitter.com/LovelyJiae521/status/1184827390217748480,0,0
2019-10-17,13:43:53,rhqckd323,오늘 퀸덤 하는 날이엇지..? ㅅㅂ... 재방 몇시니,https://twitter.com/rhqckd323/status/1184827371716673536,0,0
2019-10-17,13:43:51,min_to_gi_moo,진짜 어떡해 나 퀸덤 보면서 울컥해써.... I miss you 지짜 짱이야ㅠㅠ,https://twitter.com/min_to_gi_moo/status/1184827365064466432,0,0
2019-10-17,13:43:50,WingWing_S2_,나 스터디 끝나고 바로 퀸덤 켜서 보느넫 진짜 무대 다 대박....,https://twitter.com/WingWing_S2_/status/1184827361172213761,0,0
2019-10-17,13:43:49,dalcrose,소원성취쇼 퀸덤… ,https://twitter.com/dalcrose/status/1184827354658394114,0,1
2019-10-17,13:43:44,katori_yui,아 퀸덤.... 존나 ㅏㄱ고싶은데 돈도 많이들고 몸도 피곤할테고... 근데 당첨되면 가야지,https://twitter.com/katori_yui/status/1184827333707849730,0,0
2019-10-17,13:43:42,99_7b,솔직히 퀸덤버전 리메이크곡들 노래방에 넣어 주면 안 대나,https://twitter.com/99_7b/status/1184827328372695040,0,0
2019-10-17,13:43:42,sjdnfkel,난쓰레기야 퀸덤 시간 놓쳤어,https://twitter.com/sjdnfkel/status/1184827328330752002,0,1
2019-10-17,13:43:39,NotMichaelButch,액시야사랑해 우주소녀퀸덤나오면어떡해,https://twitter.com/NotMichaelButch/status/1184827316087619584,0,3
2019-10-17,13:43:38,MnetKR,[퀸덤/8회] '흡사 민요' 화사표 으르렁ㅣ퀸덤 방석 퀴즈 #2 K-POP 여왕의 자리를 두고 펼쳐지는 #걸그룹 #컴백 전쟁! Mnet ‘퀸덤(Queendom)’ #AOA #여자아이들 #러블리즈 #마마무 #오마이걸 #박봄 #Mnet ‘#퀸덤(#Queendom)’ 매주 목요일 밤 9시 20분 본방사수,https://twitter.com/MnetKR/status/1184827310546944000,244,826
2019-10-17,13:43:36,velvet_exo_,퀸덤무대 유튜브로 풀로 볼거다 트위터로 미리 안볼거야ㅠ 빨리 집가ㅠ,https://twitter.com/velvet_exo_/status/1184827302699397121,0,0
2019-10-17,13:43:25,Panda_by_Friend,따흑 퀸덤 보고 싶다,https://twitter.com/Panda_by_Friend/status/1184827254645243905,0,0
2019-10-17,13:43:24,yeon_myeong,퀸덤에서 북극소녀 하는 여친자구,https://twitter.com/yeon_myeong/status/1184827249763053569,1,1
2019-10-17,13:43:18,MMM_Duri,2019/10/17 퀸덤 &lt;I miss you&gt; 문별 가사 네가 처음 불러준 내 이름 쉴 틈 없이 달려오느라 다 담아내지 못한 나의 기억의 필름 내 사계절을 만들어준 너의 체온 가득 후회없이 어제를 살고 오늘을 웃어 내일의 너 나 우리를 그리워하며,https://twitter.com/MMM_Duri/status/1184827225704546309,2,9
2019-10-17,13:43:16,patch_izps_,퀸덤 대체 웨 7일 편성 아냐,https://twitter.com/patch_izps_/status/1184827216657387521,0,0
2019-10-17,13:43:13,sai1ingship,이다음 무대가 끝이라니ㅠㅜ 퀸덤2 빨리 준비해라 EXID 꼭 나와야 되는 거 알지,https://twitter.com/sai1ingship/status/1184827207572574208,0,1
2019-10-17,13:43:11,NF_cottoncandy,아 퇴근하고 오면 퀸덤 스녑부분 당연히 놓칠 줄 알았는데ㅠㅠㅠㅠㅠㅠ 타이밍 대박이다 햅삐,https://twitter.com/NF_cottoncandy/status/1184827198953246720,0,0
2019-10-17,13:43:11,Hihu_LN,아 지금 퀸덤하니?,https://twitter.com/Hihu_LN/status/1184827195211927552,0,1
2019-10-17,13:43:10,_Lee2en,머야 퀸덤 어땠길래 다들 이리 폭풍눈물을,https://twitter.com/_Lee2en/status/1184827194779955200,0,1
2019-10-17,13:43:02,monawo1d,오늘 진짜 무대 이것밖에 안하냐... 퀸덤 연장방송해라...,https://twitter.com/monawo1d/status/1184827159900127233,0,0
2019-10-17,13:43:02,free_ze_0,퀸덤 보면서 aoa 진짜 넘 좋아짐 거기 나오는 분들 다 좋아 프로 간잽러,https://twitter.com/free_ze_0/status/1184827158511796224,0,0
2019-10-17,13:42:39,starsspace_1222,아 나 정말 다음 퀸덤 꼭 갈래ㅜㅜㅜㅜㅠㅠㅜㅜㅠㅜ 이번에 못 간거 너무 아쉽다,https://twitter.com/starsspace_1222/status/1184827062801981442,0,0
2019-10-17,13:42:38,fond_night,지금 혼자만 퀸덤 안보고있어서 어리둥절ㅠㅠㅠㅜㅜ,https://twitter.com/fond_night/status/1184827058406318080,0,0
2019-10-17,13:42:24,real_truth_luna,꿈을 실현시켜주는 퀸덤 5000천만회까지 하자. 그놈의 킹덤.만들지말고.,https://twitter.com/real_truth_luna/status/1184826998415220736,0,0
2019-10-17,13:42:24,MnetKR,[퀸덤/8회] 스페셜 평가단 선택권을 잡아라!ㅣ퀸덤 방석 퀴즈 #1 K-POP 여왕의 자리를 두고 펼쳐지는 #걸그룹 #컴백 전쟁! Mnet ‘퀸덤(Queendom)’ #AOA #여자아이들 #러블리즈 #마마무 #오마이걸 #박봄 #Mnet ‘#퀸덤(#Queendom)’ 매주 목요일 밤 9시 20분 본방사수,https://twitter.com/MnetKR/status/1184826998335533057,95,362
2019-10-17,13:42:19,do_remizzang,나도 퀸덤 보고싶어,https://twitter.com/do_remizzang/status/1184826981046579200,0,1
2019-10-17,13:42:14,MoomooITALIA,"[191017] #queendom E... niente, lascio a voi l'ultima parola I Miss You - Mamamoo #MAMAMOO #마마무 #SOLAR #솔라 #MOONBYUL #문별 #WHEEIN #휘인 #HWASA #화사 #mmm #korea #kpopitalia #퀸덤 ",https://twitter.com/MoomooITALIA/status/1184826956589780992,4,5
2019-10-17,13:42:02,MMMclip,191017 퀸덤 8회 #마마무 아미슈 ts 600MB http://sendanywhe.re/Z4I29BYH http://sendanywhe.re/50GB13NQ http://sendanywhe.re/98RJK9ZN 구글 http://bit.ly/35LnIHA #MAMAMOO,https://twitter.com/MMMclip/status/1184826909235875840,144,245
2019-10-17,13:41:58,kvousme,เป็นสเตจที่หายใจไม่ทั่วท้องเลย [8회] ♬ 싫다고 말해(Nightmare Ver.) - (여자)아이들 @3차 경연 팬도라의 상자 컴백전쟁 : 퀸덤 8화 ,https://twitter.com/kvousme/status/1184826889824657408,0,2
2019-10-17,13:41:45,cuttymilk,하아... 퀸덤 마마무 무대... 너무 좋다..ㅠㅠ,https://twitter.com/cuttymilk/status/1184826835193876480,0,3
2019-10-17,13:41:42,Sth_fresh,나 자느라 퀸덤 못 봤다 말 되냐,https://twitter.com/Sth_fresh/status/1184826825551142912,0,4
2019-10-17,13:41:41,RedCheshireCatW,퀸덤 좀만 일찍하지!!!!!!!! 시벌!!!!!!!,https://twitter.com/RedCheshireCatW/status/1184826821629468672,0,0
2019-10-17,13:41:38,leeai_001,탐라에 퀸덤과 마마무 이야기가 떠서 마마무 넘 좋아요 곧 덕질 할지도 모르겠어요... ,https://twitter.com/leeai_001/status/1184826808178339840,0,0
2019-10-17,13:41:37,Pa_songsong_23,전소연 능력치 뭐야 진짜 그냥 첨부터 편곡 준비해두고 퀸덤 출연제의 들어와서 앗사~ 이러고 나온것같음;;;,https://twitter.com/Pa_songsong_23/status/1184826800934813698,1,8
2019-10-17,13:41:33,mydream_Billion,오늘 퀸덤이여? 내일인줄,https://twitter.com/mydream_Billion/status/1184826785013227520,0,0
2019-10-17,13:41:32,jihwa9712,아 런닝 뛰면서 퀸덤 보다 말았어 이 찝찝한 기분!! 재방 다시 봐야지,https://twitter.com/jihwa9712/status/1184826783377420289,0,0
2019-10-17,13:41:29,fhvks369,드디어 퀸덤에 락버젼이,https://twitter.com/fhvks369/status/1184826771444846593,0,4
2019-10-17,13:41:22,_977H,퀸덤 못봐서 화가 나... 내일 학교 갔다오자마자 본다 싀앙,https://twitter.com/_977H/status/1184826741837070338,0,0
2019-10-17,13:41:10,MnetKR,[퀸덤/8회] 'AOA 할 수 있G~' 팬들이 원한 AOA표 유닛 무대에 도전! K-POP 여왕의 자리를 두고 펼쳐지는 #걸그룹 #컴백 전쟁! Mnet ‘퀸덤(Queendom)’ #AOA #여자아이들 #러블리즈 #마마무 #오마이걸 #박봄 #Mnet ‘#퀸덤(#Queendom)’ 매주 목요일 밤 9시 20분 본방사수,https://twitter.com/MnetKR/status/1184826689919930368,57,310
2019-10-17,13:41:02,UMOO_S,지금 퀸덤 못보고 있지만 탐라보니...흑흑....,https://twitter.com/UMOO_S/status/1184826655837016064,0,0
2019-10-17,13:41:01,SYONG2_MIN,응 ? 퀸덤 ㅠ ㅡ ㅠ 아이들 수록곡 무대 했는데 대박쓰 낼 음원 공개,https://twitter.com/SYONG2_MIN/status/1184826652666150913,0,0
2019-10-17,13:40:56,TXKXI,퀸덤 나오는 사람들 하나도 빠짐 없이 다 사랑하게 됨 ㅋㅋㅋㅋㅋㅋㅋㅋㅋㅋㅋㅋㅋㅋㅋㅋㅋㅋㅋㅋ,https://twitter.com/TXKXI/status/1184826630927081472,1,0
2019-10-17,13:40:54,bombommee,하 퀸덤에서 옴걸 팬카페 등업글까지 쓰게 될줄이야... 진짜 승희밖에 모르고 멤버들 아무도 몰랐고 비밀정원 불꽃놀이 다계절도 작년말에 알게되었는데 내가 이렇게 되다니 퀸덤 책임져... 옴걸 사랑해ㅜㅜ,https://twitter.com/bombommee/status/1184826623960350720,0,0
2019-10-17,13:40:51,oLoOLOLoLOoO,퀸덤잼밌나맨날미루고안범,https://twitter.com/oLoOLOLoLOoO/status/1184826609083174912,0,1
2019-10-17,13:40:50,mamamoon_lovely,진짜 이번 퀸덤무대 울컥한다,https://twitter.com/mamamoon_lovely/status/1184826607711580161,0,1
2019-10-17,13:40:46,diary_of_blank,오마이걸 내얘길들어봐때 처음 알았고 그때부터 혼자 좋아했는데... 요즘 퀸덤에서 실력으로 계속 좋은 성적 거두는 것 보니까 내가 다 기쁘다 점점 팬들도 많아지는 것 같아서 좋아,https://twitter.com/diary_of_blank/status/1184826588774322176,0,6
2019-10-17,13:40:42,_kkates,[8회] ♬ 싫다고 말해(Nightmare Ver.) - (여자)아이들 @3차 경연 팬도라의 상자 컴백전쟁 : 퀸덤 8화 https://youtu.be/TorT6Rgl-Kc ,https://twitter.com/_kkates/status/1184826571091140609,2,0
2019-10-17,13:40:36,mudeng_0938,바뀐 눈물지뢰 놓지 않을게 별 바람 꽃 태양 I am a fan New!)퀸덤 버전 I Miss You,https://twitter.com/mudeng_0938/status/1184826547644981248,4,9
2019-10-17,13:40:34,Chouxcreamm_,[8회] ♬ 싫다고 말해(Nightmare Ver.) - (여자)아이들 @3차 경연 팬도라의 상자 컴백전쟁 : 퀸덤 8화 https://youtu.be/TorT6Rgl-Kc via @YouTube,https://twitter.com/Chouxcreamm_/status/1184826539474423808,0,0
2019-10-17,13:40:27,cherishyoou,#퀸덤 아이들 - 싫다고 말해(3) ,https://twitter.com/cherishyoou/status/1184826507648102400,84,23
2019-10-17,13:40:18,gowrich_mm,191017 퀸덤 마마무 MAMAMOO I Miss You 3 ,https://twitter.com/gowrich_mm/status/1184826470071275520,380,443
2019-10-17,13:40:14,Mimyohan_dog,퀸덤재밌음,https://twitter.com/Mimyohan_dog/status/1184826453742870528,0,0
2019-10-17,13:40:04,mmyy95,"[8회] '김밥 받아줘서 고마워 ' 너는 김, 나는 밥! 이제는 친구가 된 구오 컴백전쟁 : 퀸덤 8화 https://youtu.be/Eq742v4920M กูโอสุดน่ารัก",https://twitter.com/mmyy95/status/1184826414203146240,0,0
2019-10-17,13:40:04,Narae_Flower_,퀸덤 맘무 공연보고 울컥했다 ,https://twitter.com/Narae_Flower_/status/1184826412575813637,0,0
2019-10-17,13:39:58,JMB_1125,여러분 이번 퀸덤무대 역대급이였죠? 마마무가 노력하는만큼 우리 무무들도 노력해야겠죠?? 우리 퀸덤노래 나올땐 꼭 우리 노력해서 1등 만들어줍시다 :),https://twitter.com/JMB_1125/status/1184826389096103938,2,9
2019-10-17,13:39:56,rlachlsia,[8회] ♬ 싫다고 말해(Nightmare Ver.) - (여자)아이들 @3차 경연 팬도라의 상자 컴백전쟁 : 퀸덤 8화 https://youtu.be/TorT6Rgl-Kc - @YouTube,https://twitter.com/rlachlsia/status/1184826379986059266,0,0
2019-10-17,13:39:45,bomsgifs,This. This is the content I live for. Bom deserves to have all the friends. Thank you Seunghee and Hyojung and all the girls on Queendom for lighting up Bom’s life on this show ps. 2NE1 crumbs #ParkBomQueendom #박봄 #퀸덤 ,https://twitter.com/bomsgifs/status/1184826333869858822,387,950
2019-10-17,13:39:35,MnetKR,[퀸덤/8회] '포X몬이 왜 거기서 나와?..' 비글미 낭낭한 마마무 선곡회의 K-POP 여왕의 자리를 두고 펼쳐지는 #걸그룹 #컴백 전쟁! Mnet ‘퀸덤(Queendom)’ #AOA #여자아이들 #러블리즈 #마마무 #오마이걸 #박봄 #Mnet ‘#퀸덤(#Queendom)’ 매주 목요일 밤 9시 20분 본방사수,https://twitter.com/MnetKR/status/1184826291331035136,412,1217
2019-10-17,13:39:23,blissful_0613,아..퀸덤 ㅠㅠㅠㅠㅠㅠㅠ,https://twitter.com/blissful_0613/status/1184826242874273793,0,0
2019-10-17,13:39:02,xenus_c,으악 미쳤나봐 야구 보다가 퀸덤을 깜박했네ㅜㅜㅜㅜㅜ 마마무 어땠나아... 아이들은ㅜㅜㅜ,https://twitter.com/xenus_c/status/1184826153317462016,0,0
2019-10-17,13:38:58,Ariaspinel,퀸덤 10부작인거 넘나 아쉽다,https://twitter.com/Ariaspinel/status/1184826136263450624,0,0
2019-10-17,13:38:57,pinkkuranger81,퀸덤 넘 재미지다,https://twitter.com/pinkkuranger81/status/1184826132597600256,0,0
2019-10-17,13:38:56,BH_liebe,퀸덤 재밋쬬,https://twitter.com/BH_liebe/status/1184826125786042368,0,0
2019-10-17,13:38:41,gungkal,아직도 눈물이난다 퀸덤콘서트 열여줘ㅠㅠㅠㅠㅠㅠㅠㅠ,https://twitter.com/gungkal/status/1184826066453483521,0,1
